id,title,cabinet_title,full_title,list_title,entity_type,subtype,address,short_address,full_address,map_address,city_address,latitude,longitude,description,conditions,price_min,price_max,daily_price_min,daily_price_max,currency_id,currency_title,currency_symbol,prepayment,rooms_total,bedroom_total,count_rooms,count_reviews,count_real_reviews,rating_overall,entity_rating,total_rating,user_rating,stars,country_id,region_id,city_id,aria_id,count_photos,count_guest,count_guest_max,categories_count,occupied_categories,last_reserve,last_reserve_label,is_new,is_instant_reserve,is_searchable_and_has_prices,allow_quota,food_type_label,food_type_text_short,food_type_text_full,status_enabled,status_checked,status_deleted,owner_first_time,owner_update_time,ros_accreditation_code,ros_accreditation_url,ics_export_link,more_often,more_often_type,params,url
425543,"Отель ""Звезда""","Отель ""Звезда""","Отель ""Звезда""","Отель ""Звезда""",hotel,hotel_mini,"Иркутск, улица Ядринцева, 1-Ж","улица Ядринцева, 1-Ж","Россия, Иркутская область, Иркутск","Россия, Иркутская область, Иркутск, улица Ядринцева, 1-Ж",Иркутск,52.277831,104.336524,"Добро пожаловать в Иркутск!

В уютном и комфортабельном районе Иркутска расположился гостиничный комплекс «Звезда». Дорога из аэропорта до нас займёт около 10 минут на автомобиле. Территория отеля закрытая: охраняется профессионалами службы безопасности. По периметру «Звезды» величаво возвышаются вековые ели, благодаря этому у нас всегда свежий воздух и атмосфера умиротворения.

Все номера отеля оформлены в классическом стиле с изысканными элементами декора. Оснащение номерного фонда современное и соответствует всем стандартам, существующим в гостиничной сфере. Свежий воздух и мягкая кровать — этот дуэт позволит Вам расслабиться после продуктивного дня и восстановить силы.Утолить голод гости могут в двух ресторанах гостиничного комплекса. Оба заведения концептуальны и аутентичны. В ресторане «Охотников» изобилуют блюда из мяса, сибирские закуски и напитки. Повара этого ресторана истинные виртуозы: шашлык из дичи, вяленая косуля, «трофеи охотника» и многое другое — эти блюда не оставят равнодушными никого. Ресторан «Китайский иероглиф» высоко ценится любителями азиатской кухни. В меню этого ресторана представлены разнообразные блюда китайской и паназиатской кухни. «Изюминкой» меню являются блюда из дичи, приготовленные по авторским рецептам шеф-повара ресторана, который адаптировал их под все каноны китайской кухни.

Для проведения бизнес-мероприятий в «Звезде» есть 2 больших конференц-зала, комната переговоров. Все помещения оснащены современной техникой. В организации мероприятия всегда оказывают квалифицированную помощь сотрудники гостиничного комплекса.

ГК «Звезда» — гостиничный комплекс для путешествующих персон!","Заселение  в отель  в 14:00
Выезд  из отеля до 12:00",5000,35000,4000,28000,RUB,Рубль,₽,20,64,,1,9,5,89,8,100,0,4,1,251,3394,0,66,0,0,4,0,2026-01-13 11:47:37,,False,True,True,True,,,,,,,,,С382024004092,https://tourism.fsa.gov.ru/ru/resorts/hotels/304c5973-c609-11ef-92da-7963a24505da,https://tvil.ru/entity/ical/ics/425543/,,,"{""transfer_from_railway_station"": ""Предоставляется, не входит в стоимость"", ""transfer_to_railway_station"": ""Предоставляется, не входит в стоимость"", ""transfer_from_airport"": ""Предоставляется, не входит в стоимость"", ""transfer_to_airport"": ""Предоставляется, не входит в стоимость"", ""distance_to_sea"": null}",https://tvil.ru/entity/425543
1657867,"Гостевой дом ""Прасковья""","Гостевой дом ""Прасковья""","Гостевой дом ""Прасковья"" на 12 комнат","Гостевой дом ""Прасковья""",hotel,hotel_dom,"Саянск, микрорайон Юбилейный, 13","микрорайон Юбилейный, 13","Россия, Иркутская область, Саянск","Россия, Иркутская область, Саянск, микрорайон Юбилейный, 13",Саянск,54.109877,102.163482,"Расположенный в самом сердце нашего тихого городка, гостиничный комплекс ""Прасковья"" приглашает вас окунуться в атмосферу спокойствия и комфорта. 
▌ Почему выбирают нас?
- Просторные светлые комнаты с панорамными окнами, открывающие вид на сосновый бор 
- Стильный интерьер, выдержанный в теплых пастельных оттенках, создает ощущение домашнего тепла и уюта.
- Высококачественное белье: наши гости наслаждаются чистотой и свежестью  белоснежных простыней.
- Комфортные матрасы Askona: обеспечивают идеальный отдых после насыщенного дня.
- Удобства: бесплатный Wi-Fi,  уютная кухня, а также бесплатная парковка рядом с гостиничным комплексом.
✨ СПА-зона: расслабьтесь и восстановите силы среди роскоши и гармонии. Наслаждайтесь гидромассажем, сауной, хамамом, купелью,  комфортной зоной отдыха и профессиональными массажами, выполненными квалифицированными специалистами.
  Центр здоровья и красоты: поддерживайте свое здоровье и красоту ежедневно благодаря современным процедурам косметологии и ухода за лицом и телом. Наши специалисты подберут индивидуальные программы оздоровления и релаксации.
 ? Фитоцентр ""Прасковья:
- Фиточайная церемония: отведайте целебные чаи из трав Алтая, приготовленные вручную.
- Паровые процедуры: почувствуйте пользу банных процедур с ароматерапией хвойных и травяных настоев.
- Программа детоксикации: восстанавливаем баланс организма и укрепляем иммунитет природными средствами.
Наш центр заботится о каждой клеточке вашего тела, помогая восстановить жизненные силы и вернуть гармонию души и тела.
Откройте для себя природу отдыха и восстановления в уникальном пространстве, наполненном ароматом цветов и растений, теплом деревянных стен и энергией живой природы.
  Фитнес-центр: работайте над своей физической формой в просторном зале  под руководством опытных инструкторов. Поддерживать себя в форме теперь легко и приятно!
Отдыхайте телом и душой в нашем гостиничном комплексе!!!!
Позвольте себе лучшее в нашем гостиничном комплексе, где заботятся о вашем комфорте и благополучии каждый день.
Насладитесь приятным отдыхом вдали от городской суеты и погрузитесь в мир тишины и покоя вместе с нами!
Добро пожаловать в гостиничный комплекс ""Прасковья""
⎯⎯⎯⎯⎯⎯⎯⎯⎯⎯
Хотите попробовать прямо сейчас бронируйте посещение уже сегодня! ✅",Время заезда 14.00 по местному времени. Время выезда 12.00 по местному времени. Принимает с детьми любого возраста. Проживание с домашними питомцами запрещено.  ,1800,5400,1440,4320,RUB,Рубль,₽,20,12,,1,0,0,0,8,,0,3,1,251,3367,0,20,0,0,5,0,2025-12-26 15:46:05,,False,True,True,True,,,,,,,,,С382025006009,https://tourism.fsa.gov.ru/ru/resorts/hotels/4243d212-7428-11f0-bd79-b992068ceaff,https://tvil.ru/entity/ical/ics/1657867/,,,"{""transfer_from_railway_station"": ""Не предоставляется"", ""transfer_to_railway_station"": ""Не предоставляется"", ""transfer_from_airport"": ""Не предоставляется"", ""transfer_to_airport"": ""Не предоставляется"", ""distance_to_sea"": null}",https://tvil.ru/entity/1657867
2052427,"Гостевой дом ""Небо Байкала""","Гостевой дом ""Небо Байкала""","Гостевой дом ""Небо Байкала""","Гостевой дом ""Небо Байкала""",hotel,hotel_dom,"Листвянка, улица Горького, 133/2","улица Горького, 133/2","Россия, Иркутская область, Листвянка","Россия, Иркутская область, Листвянка, улица Горького, 133/2",Листвянка,51.842467,104.880916,"Гостевой дом ""Небо Байкала"" расположен в центре туристического поселка Листвянка. Для проживания гостям предлагаются 7 домиков с собственными и общими удобствами. В домиках комфортабельные спальные места, есть небольшая терраса, гостям предоставляются полотенца и постельное белье. На территории имеются места для курения, общая кухня, мангальная зона, по предварительному согласованию возможно проживания с домашними животными.",,3000,3000,2400,2400,RUB,Рубль,₽,20,7,,1,0,0,0,8,,0,,1,251,3364,0,11,0,0,1,0,2026-01-22 17:30:01,20 часов назад,False,True,True,True,,,,,,,,,,,https://tvil.ru/entity/ical/ics/2052427/,,,"{""transfer_from_railway_station"": ""Не предоставляется"", ""transfer_to_railway_station"": ""Не предоставляется"", ""transfer_from_airport"": ""Не предоставляется"", ""transfer_to_airport"": ""Не предоставляется"", ""distance_to_sea"": null}",https://tvil.ru/entity/2052427
1525970,"Гостевой дом ""ФИЛОКСЕНИЯ""","Гостевой дом ""ФИЛОКСЕНИЯ""","Гостевой дом ""ФИЛОКСЕНИЯ""","Гостевой дом ""ФИЛОКСЕНИЯ""",hotel,hotel_dom,"Хужир, Горная улица, 1Б","Горная улица, 1Б","Россия, Иркутская область, Хужир","Россия, Иркутская область, Хужир, Горная улица, 1Б",Хужир,53.195651,107.335049,"Гостевой Дом ФИЛОКСЕНИЯ предлагает гостям обширную экскурсионную программу, а также тихий отдых на первой линии вблизи Шаманки и пляжных зон. 

Во дворе беседка, мангальная зона, баня и теплый гараж.

Милости просим на славное море - священный Байкал!","Пожалуйста, сообщайте нам, что Вы уже переправились паромом на остров, чтобы мы подготовили номер к заселению.",7200,26600,5760,21280,RUB,Рубль,₽,20,2,,1,2,1,0,7,100,0,,1,251,28469,0,53,0,0,2,0,2025-08-09 17:07:51,,False,True,True,True,,,,,,,,,,,https://tvil.ru/entity/ical/ics/1525970/,Большой спрос: 36% семьи с детьми,PercentWithChildren,"{""transfer_from_railway_station"": ""Предоставляется, не входит в стоимость"", ""transfer_to_railway_station"": ""Предоставляется, не входит в стоимость"", ""transfer_from_airport"": ""Предоставляется, не входит в стоимость"", ""transfer_to_airport"": ""Предоставляется, не входит в стоимость"", ""distance_to_sea"": ""100 м""}",https://tvil.ru/entity/1525970
1097942,Hotel Olhon 2*,Hotel Olhon 2*,Hotel Olhon 2*,Hotel Olhon 2*,hotel,hotel_common,"Хужир, Байкальская улица, 64/1","Байкальская улица, 64/1","Россия, Иркутская область, Хужир","Россия, Иркутская область, Хужир, Байкальская улица, 64/1",Хужир,53.194243,107.354030,"Кемпинг «Ольхон» расположен в поселке Хужир на острове Ольхон. Все номера благоустроенные (душ и туалет в номере). К услугам гостей бесплатный Wi-Fi на ресепшн, кафе, детская площадка и принадлежности для барбекю. Поможем с организацией экскурсий. В пешей доступности пляж, мыс Бурхан, магазины.","Курение в номерах, на балконах и на территории отеля строго запрещено, кроме специально отведенных мест",1000,13500,800,10800,RUB,Рубль,₽,20,28,,1,37,10,78,7,75,94,,1,251,28469,0,53,0,0,6,0,2026-01-25 07:12:02,6 часов назад,False,True,True,True,,,,,,,,,С382025006931,https://tourism.fsa.gov.ru/ru/resorts/hotels/f2af2114-79cf-11f0-b1f9-71c01e424a4b,https://tvil.ru/entity/ical/ics/1097942/,,,"{""transfer_from_railway_station"": ""Предоставляется, не входит в стоимость"", ""transfer_to_railway_station"": ""Предоставляется, не входит в стоимость"", ""transfer_from_airport"": ""Предоставляется, не входит в стоимость"", ""transfer_to_airport"": ""Предоставляется, не входит в стоимость"", ""distance_to_sea"": null}",https://tvil.ru/entity/1097942
425542,"Отель ""Европа""","Отель ""Европа""","Отель ""Европа""","Отель ""Европа""",hotel,hotel_dom,"Иркутск, Байкальская улица, 69","Байкальская улица, 69","Россия, Иркутская область, Иркутск","Россия, Иркутская область, Иркутск, Байкальская улица, 69",Иркутск,52.274696,104.304934,"Отель «Европа» расположен в культурном и историческом центре Иркутска — и это ключевое удобство. В двух минутах ходьбы от отеля располагается МТЦ «Новый» — один из крупнейших торговых центров Иркутска с брендами, ресторанами и кинотеатром. Кроме того, за 10 минут можно дойти до 130 квартала — главного архитектурного памятника деревянного зодчества, который поражает своей красотой и атмосферой.

К услугам гостей несколько категорий номеров: Стандарт, Одноместный улучшенный стандарт, Двухместный улучшенный стандарт, Бизнес, Комфорт Классик, Комфорт Модерн, Джуниор Сьют. В каждом из них - новая мебель из натурального дерева, оборудованная в каждом номере рабочая зона, классический европейский стиль в оформлении — все для того, гость чувствовал себя как дома. 
Дата основания отеля 2005 год.
На территории отеля работает ресторан европейской кухни, гости всегда могут рассчитывать на быструю подачу блюд и первоклассный сервис.",В здании отеля курение запрещено; курение в специально отведённых местах на улице.,4725,18900,3780,15120,RUB,Рубль,₽,20,63,,1,394,389,0,6,100,0,3,1,251,3394,0,38,0,0,8,0,2025-11-10 21:30:38,,False,True,True,True,,,,,,,,,С382024008141,https://tourism.fsa.gov.ru/ru/resorts/hotels/5cfb36d1-c608-11ef-92da-0b19c88797f2,https://tvil.ru/entity/ical/ics/425542/,Популярен: 49% путешествуют одни,PercentLonely,"{""transfer_from_railway_station"": ""Предоставляется, не входит в стоимость"", ""transfer_to_railway_station"": ""Предоставляется, не входит в стоимость"", ""transfer_from_airport"": ""Предоставляется, не входит в стоимость"", ""transfer_to_airport"": ""Предоставляется, не входит в стоимость"", ""distance_to_sea"": null}",https://tvil.ru/entity/425542
1390108,"Гостиница  ""Воробьевы горы""","Гостиница  ""Воробьевы горы""","Гостиница  ""Воробьевы горы""","Гостиница  ""Воробьевы горы""",hotel,hotel_common,"Иркутск, Ольхонский район, местность Тутай, 1, 1","Ольхонский район, местность Тутай, 1, 1","Россия, Иркутская область, Иркутск","Россия, Иркутская область, Иркутск, Ольхонский район, местность Тутай, 1, 1",Иркутск,53.002109,106.893550,"Отдых с видом на BAIKAL в Куполах и Сферах.
Путешествия на Вездеходах (трэколах) / Багги.
Экологично. Индивидуально. Со смыслом.","С животными по предварительному согласованию, платно - 2000 руб. единоразово. ",11000,18000,8800,14400,RUB,Рубль,₽,20,11,,1,0,0,0,6,,0,,1,251,3394,0,50,0,0,5,0,2025-07-04 06:23:50,,False,True,True,True,,,,,,,,,С382025009974,https://tourism.fsa.gov.ru/ru/resorts/hotels/caa2dc58-85b9-11f0-850f-7b3e91a26947,https://tvil.ru/entity/ical/ics/1390108/,,,"{""transfer_from_railway_station"": ""Предоставляется, не входит в стоимость"", ""transfer_to_railway_station"": ""Предоставляется, не входит в стоимость"", ""transfer_from_airport"": ""Предоставляется, не входит в стоимость"", ""transfer_to_airport"": ""Предоставляется, не входит в стоимость"", ""distance_to_sea"": null}",https://tvil.ru/entity/1390108
1747294,Гостиница,Гостиница,Гостиница,Гостиница,hotel,hotel_dom,"Иркутск, Альпийская улица, 53/1","Альпийская улица, 53/1","Россия, Иркутская область, Иркутск","Россия, Иркутская область, Иркутск, Альпийская улица, 53/1",Иркутск,52.286151,104.330850,"Сдам уютную квартиру, расположенную в шаговой доступности от улицы Советская, район остановки Омулевского. Центр компьютерной томографии, Иванович материнская больница, расположены в шаговой доступности, аэропорт 5-7 минут езды. Квартира полностью укомплектована всей необходимой бытовой техникой, Интернет, ТВ, своя закрытая парковка. Расчетный час в 12 Просьба молодых людей до 25 лет, не беспокоить!!!!",,2500,3150,2000,2520,RUB,Рубль,₽,20,6,,1,2,1,0,6,89,79,,1,251,3394,0,7,0,0,1,0,2025-05-01 09:53:26,,False,True,True,True,,,,,,,,,,,https://tvil.ru/entity/ical/ics/1747294/,,,"{""transfer_from_railway_station"": ""Не предоставляется"", ""transfer_to_railway_station"": ""Не предоставляется"", ""transfer_from_airport"": ""Не предоставляется"", ""transfer_to_airport"": ""Не предоставляется"", ""distance_to_sea"": null}",https://tvil.ru/entity/1747294
1785783,"Отель ""Белый Берег""","Отель ""Белый Берег""","Отель ""Белый Берег"" на 5 номеров","Отель ""Белый Берег""",hotel,hotel_common,"Братск, улица Курчатова, 65","улица Курчатова, 65","Россия, Иркутская область, Братск","Россия, Иркутская область, Братск, улица Курчатова, 65",Братск,56.157047,101.660975,"К услугам гостей Белого Берега - комфортабельные коттеджи с мини-кухней.

Все коттеджи располагают гостиным уголком, телевизором с плоским экраном и собственной ванной комнатой с бесплатными туалетно-косметическими принадлежностями и душем.

В отделке домов применены экологически чистые материалы из Ангарской сосны и Сибирской лиственницы. Эргономично спланированное внутреннее пространство отвечает современным требованиям комфорта и удобства наших гостей.

С террасы открывается отличный живописный вид на море.

В ресторане на территории подают блюда русской и европейской кухни.",При заселении с домашними животными взимается плата за дополнительную уборку: 1000 руб.,7500,22000,6000,17600,RUB,Рубль,₽,20,5,,1,3,0,0,6,,0,3,1,251,3382,0,42,0,0,2,0,2025-07-29 02:31:06,,False,True,True,True,,,,,,,,,С382024003967,https://tourism.fsa.gov.ru/ru/resorts/hotels/2ece3b1f-c608-11ef-92da-2bca2f8dae4c,https://tvil.ru/entity/ical/ics/1785783/,,,"{""transfer_from_railway_station"": ""Не предоставляется"", ""transfer_to_railway_station"": ""Не предоставляется"", ""transfer_from_airport"": ""Не предоставляется"", ""transfer_to_airport"": ""Не предоставляется"", ""distance_to_sea"": ""менее 50 м""}",https://tvil.ru/entity/1785783
